{
  "agents": {
    "active": [
      {
        "category": null,
        "id": "gsd-executor",
        "model": "unspecified",
        "status": "active"
      },
      {
        "category": null,
        "id": "sgsd-board-architect",
        "model": "sonnet",
        "status": "active"
      },
      {
        "category": null,
        "id": "sgsd-board-contrarian",
        "model": "sonnet",
        "status": "active"
      },
      {
        "category": null,
        "id": "sgsd-board-moonshot",
        "model": "sonnet",
        "status": "active"
      },
      {
        "category": null,
        "id": "sgsd-board-pragmatist",
        "model": "sonnet",
        "status": "active"
      },
      {
        "category": null,
        "id": "sgsd-board-researcher",
        "model": "sonnet",
        "status": "active"
      },
      {
        "category": null,
        "id": "sgsd-ceo",
        "model": "opus",
        "status": "active"
      },
      {
        "category": null,
        "id": "sgsd-classifier",
        "model": "haiku",
        "status": "active"
      },
      {
        "category": null,
        "id": "sgsd-code-reviewer",
        "model": "sonnet",
        "status": "active"
      },
      {
        "category": null,
        "id": "sgsd-codex-reviewer",
        "model": "external",
        "status": "active"
      },
      {
        "category": null,
        "id": "sgsd-context-selector",
        "model": "haiku",
        "status": "active"
      },
      {
        "category": "C",
        "id": "sgsd-exec-backend",
        "model": "unspecified",
        "state": "active",
        "status": "active"
      },
      {
        "category": "C",
        "id": "sgsd-exec-config",
        "model": "unspecified",
        "state": "active",
        "status": "active"
      },
      {
        "category": "C",
        "id": "sgsd-exec-docs",
        "model": "unspecified",
        "state": "active",
        "status": "active"
      },
      {
        "category": "C",
        "id": "sgsd-exec-fix",
        "model": "unspecified",
        "state": "active",
        "status": "active"
      },
      {
        "category": "C",
        "id": "sgsd-exec-integration",
        "model": "unspecified",
        "state": "active",
        "status": "active"
      },
      {
        "category": "C",
        "id": "sgsd-exec-refactor",
        "model": "unspecified",
        "state": "active",
        "status": "active"
      },
      {
        "category": "C",
        "id": "sgsd-exec-test",
        "model": "unspecified",
        "state": "active",
        "status": "active"
      },
      {
        "category": "C",
        "id": "sgsd-exec-ui",
        "model": "unspecified",
        "state": "active",
        "status": "active"
      },
      {
        "category": null,
        "id": "sgsd-milestone-readiness",
        "model": "sonnet",
        "status": "active"
      },
      {
        "category": null,
        "id": "sgsd-phase-readiness",
        "model": "haiku",
        "status": "active"
      },
      {
        "category": null,
        "id": "sgsd-vtp-enrichment",
        "model": "sonnet",
        "status": "active"
      },
      {
        "category": null,
        "id": "sgsd-workflow-auditor",
        "model": "sonnet",
        "status": "active"
      }
    ],
    "superseded": []
  },
  "artifacts": {
    "active": [
      {
        "id": "atc_review",
        "source": "phase43-CAPSULE_FILE_KINDS"
      },
      {
        "id": "context",
        "source": "phase43-CAPSULE_FILE_KINDS"
      },
      {
        "id": "plan",
        "source": "phase43-CAPSULE_FILE_KINDS"
      },
      {
        "id": "research",
        "source": "phase43-CAPSULE_FILE_KINDS"
      },
      {
        "id": "verification",
        "source": "phase43-CAPSULE_FILE_KINDS"
      }
    ],
    "superseded": []
  },
  "commands": {
    "active": [
      {
        "first_wave": true,
        "id": "atc-review",
        "source": "envelope-v1.yaml"
      },
      {
        "first_wave": true,
        "id": "audit",
        "source": "envelope-v1.yaml"
      },
      {
        "first_wave": true,
        "id": "checkTokenWaste",
        "source": "phase42"
      },
      {
        "first_wave": true,
        "id": "codex-exec",
        "source": "envelope-v1.yaml"
      },
      {
        "first_wave": false,
        "id": "crit-backlog",
        "source": "envelope-v1.yaml"
      },
      {
        "first_wave": false,
        "id": "edge-guard",
        "source": "envelope-v1.yaml"
      },
      {
        "first_wave": false,
        "id": "handoff",
        "source": "envelope-v1.yaml"
      },
      {
        "first_wave": false,
        "id": "heartbeat",
        "source": "envelope-v1.yaml"
      },
      {
        "first_wave": true,
        "id": "logTokenSpend",
        "source": "phase41"
      },
      {
        "first_wave": true,
        "id": "sgsd-muda-audit",
        "source": "envelope-v1.yaml"
      },
      {
        "first_wave": true,
        "id": "sgsd-readiness-probe",
        "source": "envelope-v1.yaml"
      },
      {
        "first_wave": false,
        "id": "token-log",
        "source": "envelope-v1.yaml"
      },
      {
        "first_wave": true,
        "id": "writeCapsule",
        "source": "phase43"
      }
    ],
    "superseded": []
  },
  "gates": {
    "active": [
      {
        "category": "process-hygiene",
        "enforcement_mode": "soft-warn",
        "id": "classifier-haiku",
        "state": "active"
      },
      {
        "category": "process-hygiene",
        "enforcement_mode": "soft-warn",
        "id": "context-selector-haiku",
        "state": "active"
      },
      {
        "category": "process-hygiene",
        "enforcement_mode": "soft-warn",
        "id": "intent-injection",
        "state": "active"
      },
      {
        "category": "process-hygiene",
        "enforcement_mode": "soft-warn",
        "id": "MUDA-waste-audit",
        "state": "active"
      },
      {
        "category": "code-quality",
        "enforcement_mode": "hard-halt",
        "id": "per-dispatch-ATC",
        "state": "active"
      },
      {
        "category": "code-quality",
        "enforcement_mode": "amortized",
        "id": "phase-level-ATC",
        "state": "active"
      },
      {
        "category": "process-hygiene",
        "enforcement_mode": "soft-warn",
        "id": "qualitative-waste-audit",
        "state": "active"
      },
      {
        "category": "process-hygiene",
        "enforcement_mode": "soft-warn",
        "id": "sgsd-curate-learnings",
        "state": "active"
      },
      {
        "category": "process-hygiene",
        "enforcement_mode": "soft-warn",
        "id": "sgsd-recall-queries",
        "state": "active"
      },
      {
        "category": "process-hygiene",
        "enforcement_mode": "soft-warn",
        "id": "token-log",
        "state": "active"
      },
      {
        "category": "verify-completeness",
        "enforcement_mode": "soft-warn",
        "id": "verifier-detail-vs-summary",
        "state": "active"
      },
      {
        "category": "verify-completeness",
        "enforcement_mode": "soft-warn",
        "id": "verifier-row-arithmetic",
        "state": "active"
      },
      {
        "category": "process-hygiene",
        "enforcement_mode": "soft-warn",
        "id": "vtp-enrichment",
        "state": "active"
      }
    ],
    "superseded": []
  },
  "generated_at": "2026-04-27T20:52:42.562Z",
  "generated_by": "super-gsd/tools/context-registry/build.cjs",
  "milestones": {
    "active": [
      {
        "id": "v1.1",
        "name": null
      },
      {
        "id": "v1.2",
        "name": null
      },
      {
        "id": "v1.3",
        "name": null
      },
      {
        "id": "v1.4",
        "name": null
      },
      {
        "id": "v1.5",
        "name": null
      },
      {
        "id": "v1.6",
        "name": null
      },
      {
        "id": "v1.7",
        "name": "Stable Command Contracts And Route Intelligence"
      },
      {
        "id": "v1.8",
        "name": "Gate Fitness And MUDA Pruning"
      },
      {
        "id": "v1.9",
        "name": "Context Compression, Token Governance, And Research Routing"
      }
    ],
    "superseded": [
      {
        "evidence_path": ".planning/archive/superseded/v1.9-knowledge-memory-governance/README.md",
        "id": "v1.9-knowledge-memory-governance",
        "reason": "Mine for any scope item not covered by SGSD-Research before retiring permanently.",
        "replaced_by": "v1.9",
        "superseded_at": {}
      }
    ]
  },
  "phase_folders": {
    "active": [
      {
        "folder": "09-atc-147-evidence",
        "id": "v1.2/09-atc-147-evidence",
        "milestone": "v1.2"
      },
      {
        "folder": "10-gate-policy",
        "id": "v1.2/10-gate-policy",
        "milestone": "v1.2"
      },
      {
        "folder": "11-plan-schema-v2",
        "id": "v1.2/11-plan-schema-v2",
        "milestone": "v1.2"
      },
      {
        "folder": "12-machinery",
        "id": "v1.2/12-machinery",
        "milestone": "v1.2"
      },
      {
        "folder": "13-governance",
        "id": "v1.2/13-governance",
        "milestone": "v1.2"
      },
      {
        "folder": "14-codex-cli-provider-substrate",
        "id": "v1.3/14-codex-cli-provider-substrate",
        "milestone": "v1.3"
      },
      {
        "folder": "15-codex-routed-gates",
        "id": "v1.3/15-codex-routed-gates",
        "milestone": "v1.3"
      },
      {
        "folder": "16-vtp-enrichment",
        "id": "v1.3/16-vtp-enrichment",
        "milestone": "v1.3"
      },
      {
        "folder": "17-debt-sweep",
        "id": "v1.4/17-debt-sweep",
        "milestone": "v1.4"
      },
      {
        "folder": "18-codex-hardening",
        "id": "v1.4/18-codex-hardening",
        "milestone": "v1.4"
      },
      {